{
  "schema_version": "1.0",
  "source": {
    "package": "model-bank",
    "version": "1.0.20261008040918",
    "registry": "https://registry.npmjs.org/model-bank",
    "tarball": "https://registry.npmjs.org/model-bank/-/model-bank-1.0.20261008040918.tgz",
    "integrity": "sha512-zrBISVkYdl3nuFXD75nDjj/GiSK4qM1zLTOVU1iqkn6BY748jqFRqwkh9rhg/z01PkP4nHbyq9eO93mG5OqgMg==",
    "git_commit": "9ea9e95ef9afbf3a3c87516ad0574732df9a7506",
    "license": "LobeHub Community License",
    "license_url": "https://github.com/lobehub/lobehub/blob/canary/LICENSE"
  },
  "provider_count": 82,
  "model_count": 1883,
  "providers": {
    "ai21": {
      "jamba-large": "Jamba Large",
      "jamba-mini": "Jamba Mini"
    },
    "ai302": {
      "chatgpt-4o-latest": "chatgpt-4o-latest",
      "claude-3-7-sonnet-latest": "claude-3-7-sonnet-latest",
      "deepseek-chat": "deepseek-chat",
      "deepseek-reasoner": "deepseek-reasoner",
      "gemini-2.0-flash": "gemini-2.0-flash",
      "gemini-2.5-flash": "gemini-2.5-flash",
      "gemini-2.5-pro": "gemini-2.5-pro",
      "gemini-2.5-pro-preview-05-06": "gemini-2.5-pro-preview-05-06",
      "gpt-4.1": "gpt-4.1",
      "grok-3-beta": "grok-3-beta",
      "grok-3-mini-beta": "grok-3-mini-beta",
      "llama-4-maverick": "llama-4-maverick",
      "llama3.3-70b": "llama3.3-70b",
      "o3": "o3",
      "o4-mini": "o4-mini",
      "qwen3-235b-a22b": "qwen3-235b-a22b",
      "qwen3-32b": "qwen3-32b"
    },
    "ai360": {
      "360/deepseek-r1": "DeepSeek R1",
      "360gpt-pro": "360GPT Pro",
      "360gpt-pro-trans": "360GPT Pro Trans",
      "360gpt-turbo": "360GPT Turbo",
      "360gpt2-o1": "360GPT2 o1",
      "360gpt2-pro": "360GPT2 Pro",
      "360zhinao-pro-32k-thinking-vision": "360Zhinao Pro 32K Thinking Vision",
      "360zhinao-turbo": "360Zhinao Turbo",
      "360zhinao-turbo-qwen-plus": "360Zhinao Turbo Qwen Plus",
      "360zhinao2-o1": "360Zhinao2 o1",
      "360zhinao2-o1.5": "360Zhinao2 o1.5",
      "360zhinao3-o1.5": "360Zhinao3 o1.5",
      "deepseek-v3.2": "DeepSeek V3.2",
      "deepseek-v3.2-speciale": "DeepSeek V3.2 Speciale",
      "paratera/deepseek-v3.2": "DeepSeek V3.2 (Paratera)",
      "sophnet/deepseek-v3.2": "DeepSeek V3.2 (SophNet)",
      "volcengine/doubao-seed-2-0-code": "Doubao Seed 2.0 Code",
      "volcengine/doubao-seed-2-0-lite": "Doubao Seed 2.0 Lite",
      "volcengine/doubao-seed-2-0-mini": "Doubao Seed 2.0 Mini",
      "volcengine/doubao-seed-2-0-pro": "Doubao Seed 2.0 Pro"
    },
    "aihubmix": {
      "azure-deepseek-r1-0528": "DeepSeek R1 0528 (Azure)",
      "chatgpt-4o-latest": "ChatGPT-4o",
      "claude-haiku-4-5-20251001": "Claude Haiku 4.5",
      "claude-haiku-5-5": "Claude Haiku 5.5",
      "claude-opus-4-5-20251101": "Claude Opus 4.5",
      "claude-opus-4-6": "Claude Opus 4.6",
      "claude-opus-4-7": "Claude Opus 4.7",
      "claude-opus-5-5": "Claude Opus 5.5",
      "claude-sonnet-4-5-20250929": "Claude Sonnet 4.5",
      "claude-sonnet-4-6": "Claude Sonnet 4.6",
      "deepseek-r1": "DeepSeek R1",
      "deepseek-v3": "DeepSeek V3",
      "deepseek-v3-fast": "DeepSeek V3 (Fast)",
      "deepseek-v3.1-think": "DeepSeek V3.1 (Think)",
      "gemini-2.5-flash": "Gemini 2.5 Flash",
      "gemini-2.5-flash-image": "Nano Banana",
      "gemini-2.5-flash-lite": "Gemini 2.5 Flash-Lite",
      "gemini-2.5-pro": "Gemini 2.5 Pro",
      "gemini-3-flash-preview": "Gemini 3 Flash Preview",
      "gemini-3-pro-image-preview": "Nano Banana Pro",
      "gemini-3-pro-preview": "Gemini 3 Pro Preview",
      "gemini-3.1-flash-image-preview": "Nano Banana 2",
      "gemini-3.1-flash-lite-image:image": "Nano Banana 2 Lite",
      "gemini-3.1-flash-lite-preview": "Gemini 3.1 Flash-Lite Preview",
      "gemini-3.1-pro-preview": "Gemini 3.1 Pro Preview",
      "gpt-4.1": "GPT-4.1",
      "gpt-4.1-mini": "GPT-4.1 mini",
      "gpt-4.1-nano": "GPT-4.1 nano",
      "gpt-5": "GPT-5",
      "gpt-5-chat-latest": "GPT-5 Chat",
      "gpt-5-codex": "GPT-5 Codex",
      "gpt-5-mini": "GPT-5 mini",
      "gpt-5-nano": "GPT-5 nano",
      "gpt-5-pro": "GPT-5 pro",
      "gpt-5.1": "GPT-5.1",
      "gpt-5.1-chat-latest": "GPT-5.1 Chat",
      "gpt-5.1-codex": "GPT-5.1 Codex",
      "gpt-5.1-codex-mini": "GPT-5.1 Codex mini",
      "gpt-5.2": "GPT-5.2",
      "gpt-5.2-chat-latest": "GPT-5.2 Chat",
      "gpt-5.2-pro": "GPT-5.2 pro",
      "gpt-5.3-chat-latest": "GPT-5.3 Chat",
      "gpt-5.4": "GPT-5.4",
      "gpt-5.4-mini": "GPT-5.4 mini",
      "gpt-5.4-nano": "GPT-5.4 nano",
      "gpt-5.4-pro": "GPT-5.4 Pro",
      "gpt-5.5": "GPT-5.5",
      "gpt-6-luna": "GPT-6 Luna",
      "gpt-6-sol": "GPT-6 Sol",
      "gpt-image-2": "GPT Image 2",
      "grok-3": "Grok 3",
      "grok-3-mini": "Grok 3 Mini",
      "grok-4-20-non-reasoning": "Grok 4.20 (Non-Reasoning)",
      "grok-4-20-reasoning": "Grok 4.20",
      "grok-4.20-multi-agent-0309": "Grok 4.20 Multi-Agent",
      "grok-4.7": "Grok 4.7",
      "mimo-v2.6-flash": "MiMo-V2.6 Flash",
      "mimo-v2.6-pro": "MiMo-V2.6 Pro",
      "mimo-v2.6-pro-ultraspeed": "MiMo-V2.6 Pro UltraSpeed",
      "o3": "o3",
      "o3-deep-research": "o3 Deep Research",
      "o3-pro": "o3-pro",
      "o4-mini": "o4-mini",
      "o4-mini-deep-research": "o4-mini Deep Research",
      "qwen3-235b-a22b-instruct-2507": "Qwen3 235B A22B Instruct 2507",
      "qwen3-235b-a22b-thinking-2507": "Qwen3 235B A22B Thinking 2507",
      "qwen3-30b-a3b-instruct-2507": "Qwen3 30B A3B Instruct 2507",
      "qwen3-30b-a3b-thinking-2507": "Qwen3 30B A3B Thinking 2507"
    },
    "akashchat": {
      "deepseek-r1-distill-qwen-32b": "DeepSeek R1 Distill Qwen 32B",
      "deepseek-v3-1": "DeepSeek V3.1",
      "gpt-oss-120b": "GPT-OSS-120B",
      "meta-llama-3-1-8b-instruct-fp8": "Llama 3.1 8B",
      "meta-llama-3-3-70b-instruct": "Llama 3.3 70B",
      "meta-llama-4-maverick-17b-128e-instruct-fp8": "Llama 4 Maverick (17Bx128E)",
      "qwen3-235b-a22b-instruct-2507-fp8": "Qwen3 235B A22B Instruct 2507"
    },
    "antgroup": {
      "ling-2.6-1t": "Ling-2.6-1T",
      "ling-2.6-flash": "Ling-2.6-flash",
      "ling-3.0-flash": "Ling-3.0-flash",
      "ring-2.6-1t": "Ring-2.6-1T"
    },
    "anthropic": {
      "claude-fable-5": "Claude Fable 5",
      "claude-fable-5-1": "Claude Fable 5.1",
      "claude-haiku-4-5-20251001": "Claude Haiku 4.5",
      "claude-haiku-5-5": "Claude Haiku 5.5",
      "claude-opus-4-5-20251101": "Claude Opus 4.5",
      "claude-opus-4-6": "Claude Opus 4.6",
      "claude-opus-4-7": "Claude Opus 4.7",
      "claude-opus-4-8": "Claude Opus 4.8",
      "claude-opus-5": "Claude Opus 5",
      "claude-opus-5-5": "Claude Opus 5.5",
      "claude-sonnet-4-5-20250929": "Claude Sonnet 4.5",
      "claude-sonnet-4-6": "Claude Sonnet 4.6",
      "claude-sonnet-5": "Claude Sonnet 5"
    },
    "azure": {
      "dall-e-3": "DALL·E 3",
      "flux-1.1-pro": "FLUX.1.1 Pro",
      "flux.1-kontext-pro": "FLUX.1 Kontext [pro]",
      "gpt-4": "GPT 4 Turbo",
      "gpt-4.1": "GPT-4.1",
      "gpt-4.1-mini": "GPT-4.1 mini",
      "gpt-4.1-nano": "GPT-4.1 nano",
      "gpt-4o": "GPT-4o",
      "gpt-4o-mini": "GPT 4o Mini",
      "gpt-5": "GPT-5",
      "gpt-5-chat": "GPT-5 Chat",
      "gpt-5-codex": "GPT-5 Codex",
      "gpt-5-mini": "GPT-5 Mini",
      "gpt-5-nano": "GPT-5 Nano",
      "gpt-5-pro": "GPT-5 Pro",
      "gpt-5.1": "GPT-5.1",
      "gpt-5.2": "GPT-5.2",
      "gpt-5.4": "GPT-5.4",
      "gpt-5.4-mini": "GPT-5.4 mini",
      "gpt-5.4-nano": "GPT-5.4 nano",
      "gpt-5.4-pro": "GPT-5.4 Pro",
      "gpt-6-astra": "GPT-6 Astra",
      "gpt-6-luna": "GPT-6 Luna",
      "gpt-6-sol": "GPT-6 Sol",
      "gpt-image-1": "GPT Image 1",
      "o1": "o1",
      "o1-mini": "o1-mini",
      "o1-preview": "o1-preview",
      "o3": "o3",
      "o3-mini": "o3-mini",
      "o4-mini": "o4-mini"
    },
    "azureai": {
      "deepseek-r1": "DeepSeek R1",
      "deepseek-v3": "DeepSeek V3",
      "gpt-4.1": "GPT-4.1",
      "gpt-4.1-mini": "GPT-4.1 mini",
      "gpt-4.1-nano": "GPT-4.1 nano",
      "gpt-4.5-preview": "GPT 4.5 Preview",
      "gpt-4o": "GPT-4o",
      "gpt-4o-mini": "GPT 4o Mini",
      "o1": "o1",
      "o1-mini": "o1-mini",
      "o3": "o3",
      "o3-mini": "o3-mini",
      "o4-mini": "o4-mini"
    },
    "baichuan": {
      "baichuan-m2": "Baichuan M2",
      "baichuan-m2-plus": "Baichuan M2 Plus",
      "baichuan-m3": "Baichuan M3",
      "baichuan-m3-plus": "Baichuan M3 Plus",
      "baichuan2-turbo": "Baichuan 2 Turbo",
      "baichuan3-turbo": "Baichuan 3 Turbo",
      "baichuan3-turbo-128k": "Baichuan 3 Turbo 128k",
      "baichuan4": "Baichuan 4",
      "baichuan4-air": "Baichuan 4 Air",
      "baichuan4-turbo": "Baichuan 4 Turbo"
    },
    "bailiancodingplan": {
      "glm-4.7": "GLM-4.7",
      "glm-5": "GLM-5",
      "kimi-k2.5": "Kimi K2.5",
      "minimax-m2.5": "MiniMax-M2.5",
      "qwen3-coder-next": "Qwen3 Coder Next",
      "qwen3-coder-plus": "Qwen3 Coder Plus",
      "qwen3-max-2026-01-23": "Qwen3 Max",
      "qwen3.5-plus": "Qwen3.5 Plus"
    },
    "bedrock": {
      "anthropic.claude-3-5-sonnet-20240620-v1:0": "Claude 3.5 Sonnet 0620",
      "anthropic.claude-3-5-sonnet-20241022-v2:0": "Claude 3.5 Sonnet",
      "anthropic.claude-3-haiku-20240307-v1:0": "Claude 3 Haiku",
      "anthropic.claude-3-opus-20240229-v1:0": "Claude 3 Opus",
      "anthropic.claude-3-sonnet-20240229-v1:0": "Claude 3 Sonnet",
      "anthropic.claude-instant-v1": "Claude Instant",
      "anthropic.claude-v2": "Claude 2.0",
      "anthropic.claude-v2:1": "Claude 2.1",
      "global.anthropic.claude-haiku-4-5-20251001-v1:0": "Claude Haiku 4.5",
      "global.anthropic.claude-haiku-5-5": "Claude Haiku 5.5",
      "global.anthropic.claude-opus-4-5-20251101-v1:0": "Claude Opus 4.5",
      "global.anthropic.claude-opus-4-6-v1": "Claude Opus 4.6",
      "global.anthropic.claude-opus-4-7": "Claude Opus 4.7",
      "global.anthropic.claude-opus-5-5": "Claude Opus 5.5",